Frame,Caption
Frame 183,"Here’s a one-sentence summary of the image: A man wearing glasses and a leather jacket is sitting on a metal bed frame, looking intently and gesturing with his hands."
Frame 184,"Here’s a one-sentence summary of the image: A man in a black leather jacket sits slumped against a wall, contemplating his situation with a somber expression."
Frame 185,"A man in a leather jacket sits hunched over in a metal-paneled room, appearing contemplative or distressed."
Frame 186,"In this frame, a man in a black leather jacket is seated and appears to be reacting to something happening outside the frame, with his hands raised."
Frame 187,"Here’s a one-sentence summary of frame 187: A woman in a black leather jacket sits with her head pressed against a metal bar, seemingly struggling or distressed."
Frame 188,"A man in a leather jacket is slumped against a metal wall in a confined space, appearing distressed and possibly injured."
Frame 189,A man in a leather jacket is yelling and gesturing wildly with his hands towards a metal beam.
Frame 190,"A man in a black leather jacket is forcefully pulling himself against a metal wall, likely in a confined space."
