Frame,Caption
Frame 1,A man in a red blazer holds a wire cage filled with robotic hands.
Frame 2,A man in a red blazer holds a cage filled with robotic arms.
Frame 3,"A man in a red jacket holds a cage filled with plastic dolls, each with their arms and legs restrained by metal clips."
Frame 4,"A man in a red suit holds a wire cage containing two robotic hands, each with a metal hook attached."
Frame 5,"In this frame, a man in a red suit is presenting a cage filled with robotic hands, each with a hooked end, to a group of people."
Frame 6,"In this frame, a man in a red suit is holding a wire cage filled with mannequin hands, each connected to a device resembling a control panel."
Frame 7,"In this frame, several robotic, yellow hands are crammed into a metal basket, appearing to be part of a disturbing, macabre scene."
Frame 8,"Three people—a man in a blue jacket, a man in a red jacket, and a woman in a cream-colored sweater—are standing in front of a dark doorway, examining a small statue."
Frame 9,"In a dimly lit hallway, three people – a man in a blue jacket, an older man in a red jacket, and a woman in a cream-colored sweater – stand around a small table holding a toy."
Frame 10,"Three people – a man in a jacket, an older man, and a woman in a red sweater – stand in a dimly lit hallway, observing a statue."
Frame 11,"A stern-looking man in a red robe stands with several others in a dimly lit hallway, seemingly observing a display case."
Frame 12,"A man in a red coat stands in the doorway, partially obscured by the dark interior of a room."
Frame 13,A shadowy figure appears briefly in the doorway of a dark room.
Frame 14,A shadowy figure is partially visible through a dark doorway within a brick wall.
Frame 15,"The frame shows a dark hallway with two dark, closed doors on either side of a brick wall."
Frame 16,"In a dimly lit room with a grid-patterned ceiling, a man in a patterned sweater holds a glass while looking at a man in a denim jacket."
Frame 17,Here's a one-sentence summary of the image: A man in a leather jacket and a woman in a sweater with a shoulder strap are sitting closely together in a dimly lit space with a grid-like ceiling above them.
Frame 18,"The image shows a close-up of a pair of brown shoes standing on a gray, textured floor."
Frame 19,"A black shoe lies on a shiny, patterned floor with people’s feet visible in the background."
Frame 20,"Here’s a one-sentence summary of the image: A woman in a puffy jacket appears concerned as a man in a suit stands beside her in what appears to be a sterile, institutional setting."
Frame 21,"Here’s a one-sentence summary of the image: A woman in a gray sweater looks concerned as a man in a dark uniform observes her from a sterile, windowed room."
Frame 22,"A man’s hand is holding a metal device with a curved spout, positioned near a glass beaker."
Frame 23,"Here's a one-sentence summary of frame 23: A microphone is positioned close to a person’s face in a studio setting, presumably for audio recording."
Frame 24,A hamster is shown jumping out of its cage towards the camera.
Frame 25,"Here’s a one-sentence summary of frame 25: A person’s hand reaches through a broken cage, grasping for something within the dark, shattered interior."
Frame 26,A hand is placing a dark handgun on a patterned surface.
Frame 27,"Here’s a one-sentence summary of frame 27: A dark, blurry figure—likely a person—is partially visible on a textured, gray surface with water droplets."
Frame 28,"In this frame, a young woman with dark hair is looking down with a pensive expression in a dimly lit setting."
Frame 29,"Here's a one-sentence summary of the image: A young woman with short, messy hair looks downwards with a pensive expression in a dimly lit, indoor setting."
Frame 30,"Here's a one-sentence summary of the image: A young woman with light brown hair, wearing a gray sweater and a dark belt, looks down with a concerned or distressed expression."
Frame 31,"Here’s a one-sentence summary of the image: A young woman with long blonde hair sits with a somber expression, wearing a gray sweater and a black guitar strap, in a dimly lit room."
Frame 32,"A woman with dark hair holds a black telephone to her ear, looking intently and with a concerned expression."
Frame 33,"In this frame, Margot Tenenbaum is holding a black telephone to her ear, her expression conveying a tense and concerned demeanor."
Frame 34,"Here's a one-sentence summary of the image: A young woman with wide, concerned eyes is intently speaking on a mobile phone, seemingly in a tense or alarming situation."
Frame 35,"Here’s a one-sentence summary of the image: A young woman with long blonde hair is intently speaking on a mobile phone, her expression serious and focused."
Frame 36,Here’s a one-sentence summary of the image: A man in a black jacket is intently speaking on a cell phone while a woman watches over his shoulder.
Frame 37,A man in a dark sweater is intently speaking on a cell phone while a woman watches him with a concerned expression.
Frame 38,"Here's a one-sentence summary of the image: A woman with blonde hair, wearing a blue sweater, is looking intently at a cell phone while holding it to her ear."
Frame 39,"Here’s a one-sentence summary of the image: A woman with blonde hair is intently talking on a cell phone, her expression serious and focused."
Frame 40,"Here's a one-sentence summary of the image: A woman with blonde hair is holding a telephone to her ear, looking distressed while resting her hand on her head."
Frame 41,"Here’s a one-sentence summary of the image: A young man, dressed in a suit, is visibly startled and frantically holding a telephone to his ear."
Frame 42,"Here’s a one-sentence summary of frame 42: A young man with a shocked expression is holding a telephone to his ear, appearing to be in a state of surprise or excitement."
Frame 43,Here’s a one-sentence summary of frame 43: A man in a dark suit is intently listening to the phone with a worried and focused expression.
Frame 44,"Here's a one-sentence summary of the image: A young woman with blonde hair is visibly distressed while holding a telephone to her ear, her expression conveying shock or concern."
Frame 45,"Here's a one-sentence summary of the image: A young woman with brown hair is looking intently at a phone while holding it to her ear, seemingly engaged in a conversation."
Frame 46,"Here’s a one-sentence summary of the image: A young woman with blonde hair is intently speaking on a cell phone, her expression suggesting concern or urgency."
Frame 47,"Here's a one-sentence summary of frame 47: A young woman with blonde hair is looking down and speaking intently into a cell phone, her hand resting on her ear."
Frame 48,"A young woman with blonde hair is holding a phone to her ear, looking intently into the device with a serious expression."
Frame 49,"Here’s a one-sentence summary of frame 49: A young woman in a supermarket is visibly distressed while talking on a cell phone, looking toward the camera with an anxious expression."
Frame 50,"Here’s a one-sentence summary of the image: A young woman with short brown hair is intently listening to a phone call while leaning against a wall, seemingly distressed."
Frame 51,"Here's a one-sentence summary of the image: A young woman with blonde hair is holding a cell phone to her ear, seemingly in a moment of conversation."
Frame 52,Here's a one-sentence summary of the image: A young woman with blonde hair is holding a phone to her ear while appearing distressed in what looks like a cluttered environment.
Frame 53,"In the scene, a man in a black leather jacket and glasses intently examines a small, metallic object—likely a key or tool—with a focused expression."
Frame 54,"In this frame, a man wearing glasses and a black leather jacket is holding a golden Grammy award, with a hand reaching toward him."
Frame 55,"Here’s a one-sentence summary of frame 55: A man wearing a black leather jacket and glasses holds a metallic, curved object in his hand, looking intently at it."
Frame 56,"Here’s a one-sentence summary of the image: A man in a dark suit is holding a phone to his ear with a concerned expression, while a woman watches him in the background."
Frame 57,A man in a suit is frantically holding a phone to his ear with a shocked and concerned expression.
Frame 58,"Here’s a one-sentence summary of the image: A man in a suit is intently speaking on a cell phone, his hand on his head, suggesting he is listening carefully or in a moment of intense thought."
Frame 59,"Here’s a one-sentence summary of the image: A young man in a dark suit is intently speaking on a cell phone, with a serious and focused expression."
Frame 60,"Here's a one-sentence summary of the image: A woman with a concerned expression is holding a cell phone to her ear, likely in a tense or urgent situation."
Frame 61,"Here's a one-sentence summary of the image: A young woman with a frightened expression is holding a telephone to her ear, likely in a tense or alarming situation."
Frame 62,"Here’s a one-sentence summary of the image: A woman with a frightened expression is holding a cell phone to her ear, likely in a tense or alarming situation."
Frame 63,"Here's a one-sentence summary of frame 63: A man in glasses with a concerned expression is looking down at a hand resting on a table, possibly examining it closely."
Frame 64,Here’s a one-sentence summary of the image: A young Black man wearing glasses looks startled and concerned as he is being restrained by an unseen force.
Frame 65,"Here’s a one-sentence summary of the image: A young woman with a startled expression is holding a phone to her ear, seemingly in a moment of distress."
Frame 66,"Here's a one-sentence summary of the image: A young woman with wide, frightened eyes stares into the distance, clutching her hand as if reacting to a startling sight."
Frame 67,Here's a one-sentence summary of the image: A young woman with a startled expression and hand raised to her face appears frightened in a dimly lit environment.
Frame 68,"In this shot, Samuel L. Jackson, dressed in a black leather jacket, appears focused and slightly apprehensive as he examines a metallic object."
Frame 69,"In this frame, a man in a suit and glasses is looking intently at a blonde woman with a focused expression, likely during a tense moment in a legal setting."
Frame 70,"In this frame, a blonde woman is closely examining a silver object held by a man in a dark jacket, likely a crucial piece of evidence."
Frame 71,"The frame shows a blurry, dark interior space with a vertical, gray-blue beam or structure visible in the upper portion of the image."
Frame 72,"In this shot, a man and a woman both look upwards with a focused, intense gaze, suggesting a moment of contemplation or revelation."
Frame 73,"In this frame, a man in a red jacket stares intently upwards at a woman who is looking directly into the camera, creating a tense and unsettling moment."
Frame 74,"A woman screams in terror as she looks up at Jason Voorhees, who is reaching for her with his machete."
Frame 75,"Here's a one-sentence summary of the image: A Black man wearing glasses and a dark turtleneck is looking intently forward with a slightly furrowed brow, suggesting contemplation or focused attention."
Frame 76,Here's a one-sentence summary of frame 76: A man in glasses with a serious expression stares intently at the camera.
Frame 77,"In this frame, Mr. Tiesler is intently examining a small, metallic toy figure held by a young girl."
Frame 78,"In this frame, a person is restrained and seemingly tortured by multiple hands holding them down."
Frame 79,"Here’s a one-sentence summary of the image: A man with glasses stares intently upward, seemingly deep in thought or observation."
Frame 80,Here’s a one-sentence summary of the image: A man in a dark suit and glasses looks intently towards the camera with a serious expression.
Frame 81,"In this frame, a man with a shocked and terrified expression is being violently grabbed by a dark, shadowy figure."
Frame 82,"The frame shows a blurred close-up of a person's face, partially obscured by dark hair and a red object."
Frame 83,"In this frame, a woman with blonde hair is tightly embraced by a man in a blue jacket, appearing to be in a close, intimate moment."
Frame 84,"In this frame, a woman in a white jacket is caught in a chaotic struggle with a man in a dark jacket, with blurred movement and apparent distress."
Frame 85,"In this frame, a woman is violently restrained by a man, with her mouth open in a scream of terror."
Frame 86,"In this frame, a man in glasses with a serious expression is looking intently at a woman with a visible nose."
Frame 87,"Here's a one-sentence summary of the image: A man wearing glasses and a blue jacket is looking intently towards the right, with a serious expression."
Frame 88,"In this blurry shot, an older man with a serious expression is seemingly holding a small, ornate object, possibly a weapon, with a dark background."
Frame 89,"The frame shows a dark, metallic elevator panel with a red, flashing ""L"" illuminated on it."
Frame 90,"The camera focuses on a darkened hallway with a faint, reddish glow coming from the right side, suggesting a potential threat or ominous presence."
Frame 91,"In this frame, a man is forcefully holding a woman down, while another man looks on in a dimly lit setting."
Frame 92,"In this frame, a man is holding a young girl's head tightly, appearing to be in a violent or controlling situation."
Frame 93,"A man in a red coat is kneeling over a prone, unconscious man, holding a trombone close to his face."
Frame 94,"In this frame, a dark, vertical column of what appears to be metal or a similar material stands prominently against a warm, brown wall."
Frame 95,"The frame shows a dark, wavy pattern filling the majority of the screen, with a warm brown wall partially visible on the left side."
Frame 96,"In this frame, Walter White is partially obscured by a dark, shadowy figure, likely a member of the Salamanca cartel."
Frame 97,"In this frame, Martin Riggs is holding a gun, looking intently at the camera with a serious and tense expression."
Frame 98,"In this frame, a man in a dark jacket is seen in a tense, defensive position with a gun pointed towards the camera, suggesting a dangerous or confrontational situation."
Frame 99,"The frame shows a dark, metallic wall with a red light display spelling out the letter “L”."
Frame 100,"The frame shows a dark metallic panel with a display showing the number ""1"" in red lights."
Frame 101,"In a close-up shot, a man is being forcefully restrained with multiple hands around his head and neck."
Frame 102,A man with glasses and a beard is being held against a dark background by a hand with a watch.
Frame 103,"In the darkness, a shadowy figure with dark hair and a pale face appears partially framed in a doorway."
Frame 104,"In the darkness, a shadowy figure with glowing eyes is partially revealed, suggesting a menacing presence."
Frame 105,"In this frame, a shadowy figure is visible peering through a dark window, suggesting a sense of unease and mystery."
Frame 106,"In this frame, a shadowy figure is seen reaching out from behind a dark wooden door, suggesting a potential threat or surprise."
Frame 107,"In this frame, a man with glasses is violently pulled backwards by a man in a dark suit, with a look of extreme surprise and distress on his face."
Frame 108,"In this frame, a dark figure with a stylized head and a circular helmet is prominently visible within a dimly lit, dark room."
Frame 109,"The image shows a pair of dark brown shoes, with the front of a person's legs and feet visible beneath them, set against a dark, textured background."
Frame 110,The frame shows a pair of dark brown shoes standing on a dark floor in a dimly lit room.
Frame 111,"In this frame, a man in a dark suit is looking intently at his reflection in a window."
Frame 112,"A man in a hooded jacket peers through a dark doorway, his face illuminated by the warm light within."
Frame 113,"The video frame shows a dark, murky forest scene with a tall, brown tree trunk dominating the view."
Frame 114,"In this frame, a dark figure (likely a character) is positioned in a shadowed area with a bright, blue-toned backdrop, suggesting a dramatic and potentially intense scene."
Frame 115,"In this frame, a hand wearing a ring reaches out towards a face partially obscured by dark hair and a blanket."
Frame 116,"In this frame, a man’s hands are reaching out towards a woman’s face, which is partially obscured by dark hair and a white fabric."
Frame 117,"In this frame, a hand is reaching towards a dark, reflective surface with a faint, watery effect, likely reflecting the interior of a room."
Frame 118,"In this frame, a woman's hand, adorned with a gold ring, is reaching towards a dark, reflective surface."
Frame 119,"The image shows two dark shoes standing on a wet, reflective surface in a dimly lit room."
Frame 120,"In this frame, a viscous, dark fluid is pouring from a dark container, creating a dramatic and unsettling visual effect."
Frame 121,"In this frame, a dark, twisting metal chain is suspended in mid-air, appearing to fall downwards against a dark, reflective surface."
Frame 122,"The frame shows a dark, reflective surface with a blurred, shadowy figure’s hand reaching towards it."
Frame 123,A woman in a light-colored shirt and dark skirt is seen peering through a dark doorway into a room with a brick wall.
Frame 124,"A woman in a beige trench coat stands in a doorway, looking out at the camera with a serious expression."
Frame 125,"Here's a one-sentence summary of frame 125: A woman in a business suit is standing in a doorway, speaking urgently on the phone while holding a handbag."
Frame 126,"A man in a black shirt and jeans stands on a brick staircase, silhouetted by a light emanating from a doorway behind him."
Frame 127,A woman in a black top walks up a dark brick staircase as a man’s silhouette is visible in the doorway behind her.
Frame 128,Here's a one-sentence summary of the image: A woman with dark hair and a pale face looks intently at the camera with a slightly startled expression against a brick wall background.
Frame 129,Here's a one-sentence summary of frame 129: A woman in a white jacket stares intently into the camera with a somber expression.
Frame 130,"The frame shows a young woman with wide, frightened eyes pressed against a dark wooden wall, seemingly trapped and fearful."
Frame 131,"A woman leans against a wooden post, seemingly seeking shelter or comfort in a dimly lit, rustic setting."
Frame 132,Here’s a one-sentence summary of the image: A woman with short dark hair looks up with a startled expression as she is in a fast-moving vehicle.
Frame 133,A young woman with dark hair looks up towards an unseen object in a dimly lit room.
Frame 134,"The image shows a close-up view of a person’s hair, partially obscured by a dark fabric, suggesting a scene of intimacy or concealment."
Frame 135,"A young woman with blonde hair is leaning close to a man in a dark coat, seemingly in a moment of intimacy."
Frame 136,"In this frame, a woman with blonde hair is lying on a bed while a man in a black jacket is reaching towards her face."
Frame 137,"A person is lying on their back in a dark room, with a light shining down on them."
Frame 138,"The video shows a dark, blurry figure standing in a dimly lit hallway with wooden stairs."
Frame 139,"A dark figure stands on a staircase in a dimly lit, potentially haunted, environment."
Frame 140,"Here's a one-sentence summary of the image: A young girl with blonde hair is lying on a floor, her face partially obscured, with a look of distress or confusion."
Frame 141,"Here's a one-sentence summary of the image: A child's face, partially in shadow, is shown in a close-up with a distressed expression, likely indicating a moment of fear or distress."
Frame 142,"Here's a one-sentence summary of frame 142: A young child lies on a surface with their mouth open, their face partially illuminated by a bright light."
Frame 143,"The frame shows a dark, metallic surface with red lights forming the numbers ""41""."
Frame 144,"The frame shows a dark, metallic surface with a red LED display showing the numbers ""4 L"" in a grid pattern."
Frame 145,"In this frame, a man with dark hair leans in for a kiss with a woman with blonde hair, their faces partially obscured by the darkness."
Frame 146,"A young boy peers intently at a fluffy, white sheep."
Frame 147,A woman with blonde hair is passionately kissing a dark-haired man in a dimly lit setting.
Frame 148,"Here's a one-sentence summary of frame 148: A woman with blonde hair is leaning forward, her mouth open in a surprised or startled expression, with a blurred figure behind her."
Frame 149,The frame shows a red digital display showing the number “1.”
Frame 150,"The image shows a close-up of a young girl's face, with her eyes closed and her nose pressed against a dark surface."
Frame 151,"The image shows a close-up of a young girl's face, with her mouth open in a wide, silent expression in a dark setting."
Frame 152,"The image shows a dark, metallic panel with a bright red display showing the numbers ""415""."
Frame 153,"The image shows a blurred, close-up shot of a person's face with dark hair, partially obscured by another person's arm, against a bright, divided window."
Frame 154,"In this frame, a dark figure stands silhouetted against a wall of dark panels, suggesting a sense of mystery and possibly confinement."
Frame 155,"The frame shows a blurred, close-up shot of a person's face, partially submerged in water, likely during a struggle or underwater scene."
Frame 156,"The frame shows a dark, metallic panel with a bright red display showing the numbers ""41""."
Frame 157,"In this frame, Fred Hampton is shown violently restrained by multiple officers, his face contorted in a grimace of resistance and pain."
Frame 158,"In this frame, a woman’s face is partially visible, with a dark, shadowy background suggesting a tense or violent situation."
Frame 159,"The frame shows a close-up of a man's face, covered in blood and with a distressed expression, lying on a dark surface."
Frame 160,"Here’s a one-sentence summary of the image: A young woman with blonde hair is lying on a dark surface, with a focused expression and her mouth slightly open."
Frame 161,"The frame shows a dark, metallic wall with a red digital display showing the number ""1""."
Frame 162,"In this frame, a woman's face is shown lying on a dark, reflective surface, her eyes open and looking upwards."
Frame 163,"Here's a one-sentence summary of frame 163 of the video: A young woman's face is partially submerged in a dark, viscous substance, likely blood, with a distressed expression."
Frame 164,"In this frame, a person in a white shirt is seen leaning intensely against a door, their body contorted in a moment of apparent struggle or exertion."
Frame 165,"Here's a one-sentence summary of frame 165: A woman with blonde hair is hanging upside down in a dark room, her face obscured by her hand."
Frame 166,"In this frame, a woman in a dark outfit is thrown upwards in a struggle, likely during a fight."
Frame 167,"The elderly man in a red coat has a terrified and wide-open mouth expression, likely in response to a shocking or frightening event."
Frame 168,"In this frame, an elderly man in a red suit is seen with his mouth wide open in a startled or shocked expression."
Frame 169,"The elderly man in a red suit is frozen in a wide-eyed, terrified expression, likely reacting to a shocking event."
Frame 170,"In this frame, a man in a red jacket is seen with a shocked and fearful expression, likely reacting to a sudden event."
Frame 171,"In this frame, a man in a red coat is peering intensely through a narrow gap in a dark, wooden wall."
Frame 172,Here's a one-sentence summary of the image: A man in a leather jacket and glasses is examining a metal panel with several screws attached to it.
Frame 173,A man in glasses and a leather jacket is gesturing with his hands towards a metal frame.
Frame 174,"In this frame, a man wearing glasses and a leather jacket gestures emphatically towards a metal bar mounted on a wall."
Frame 175,"A man wearing glasses and a leather jacket is seen lying on his stomach inside a metal frame, looking up with a slightly distressed expression."
Frame 176,"Here’s a one-sentence summary of frame 176: A man wearing a leather jacket and glasses is leaning forward with his arms raised against a dark, metallic wall."
Frame 177,"In this frame, a man in a leather jacket is holding up a metal bracket, likely as part of a repair or construction task."
Frame 178,"Here’s a one-sentence summary of the image: A man wearing a leather jacket and glasses is seated in a metal frame, clenching his fists with a strained expression."
Frame 179,"A man in a leather jacket and glasses is sitting in a confined space, seemingly examining a metal bracket attached to the wall."
Frame 180,"Here's a one-sentence summary of frame 180 of the video: A man in a leather jacket and glasses is shown struggling against a metal bar secured to a wall, clearly attempting to escape."
Frame 181,"A man in a leather jacket is seated in a metal compartment, examining a metal bar with screws attached."
Frame 182,"Here's a one-sentence summary of frame 182: A man in a leather jacket is seen with his hand pressed against a wall, seemingly distressed."
