Frame,Caption
Frame 185,"The frame shows a dark, tiled floor with a shadowy figure partially visible in the foreground, amidst a pattern of floral tiles."
Frame 186,"Dark hands are reaching towards a dark, ornate wooden panel decorated with floral patterns."
Frame 187,"In a dark scene, a man with a beard and a dark cloak stares intensely into the camera."
Frame 188,A dark-faced man with a blue hooded cloak stares intensely into the camera.
Frame 189,"The image shows a dark, close-up shot of a man's face, partially obscured by a dark cloak, creating a dramatic and somewhat ominous effect."
Frame 190,"The frame shows a dark, blurred, and textured surface with numerous small, bright spots scattered across it."
Frame 191,"The frame shows a dark, blurry figure with a hood, partially obscured by shadows and a textured wall."
Frame 192,"The frame shows a dark figure in a hooded cloak, partially obscured by a pattern of paw prints against a shadowy background."
Frame 193,"A man in a hooded robe stands in a dimly lit, eerie room with a painted depiction of a religious figure on the wall."
Frame 194,"In the blurred, dark scene, a figure in dark clothing is partially visible, with a ghostly image of a woman in a haloed robe looming behind them."
Frame 195,"A dark figure is silhouetted against a frosted window, suggesting a cold and potentially ominous atmosphere."
Frame 196,"A dark-haired woman is looking out from the shadows, seemingly peering at something beyond a dark, textured wall."
Frame 197,"The frame shows a blurred, dark image of a person wearing a hooded sweatshirt, with a blurred, indistinct object visible in the background."
Frame 198,"In this frame, a figure’s face is partially visible within a dark, shadowy environment, suggesting a sense of mystery and concealment."
Frame 199,"In frame 199, a silhouetted figure is visible, seemingly mid-movement, against a gray, slightly textured background."
Frame 200,"The frame shows a group of armored soldiers walking through a dimly lit corridor, their faces obscured by helmets and dark clothing."
Frame 201,"The frame shows a group of armored figures, likely the Bat-Family, standing in a dimly lit, possibly gothic, room."
Frame 202,"The frame shows a blurry, dark scene with several people in a dimly lit, possibly crowded, interior space."
Frame 203,"The frame shows a blurry, dimly lit crowd of people, likely in a large building, with a person in a hat and a woman in a headscarf visible within the group."
Frame 204,"The image shows a figure in a black hooded robe, partially obscured by a dark background filled with what appear to be other figures, likely representing the crowds in a medieval theater."
Frame 205,"The frame shows a dark, shadowy scene with multiple figures, likely knights, surrounding a young woman in a white dress, suggesting a clandestine abduction."
Frame 206,"Here's a one-sentence summary of the image: A dark, shadowy figure in a helmet is seen partially submerged in water, suggesting a scene of suspense and intrigue from the movie ""Kidnapping of Katherine""."
Frame 207,"The image shows a dark, blurred scene with a shadowy, feline-like figure, likely a character from the video game ""The Kidnapping of Lady Katherine""."
Frame 208,"The frame shows a dark, blurred image with a figure in a hooded cloak, likely a character from the video ""Kidnapping Of Lady Katherine."""
Frame 209,"The image shows a hooded figure in a dark, shadowy scene, likely a key moment in the film “Kidnapping of Katherine.”"
Frame 210,"A hooded figure stands in a dark room, appearing tense and possibly menacing."
Frame 211,"A group of people in period clothing are gathered in a stone courtyard, their faces partially obscured by the shadows and the density of the crowd."
Frame 212,"The frame depicts a crowd of Roman soldiers and onlookers gathered in a courtyard, likely during a tense or significant moment within the movie."
Frame 213,"A knight in shining armor stands among a group of people, likely onlookers, within a stone courtyard."
Frame 214,"A knight in full armor stands in a crowd of people, appearing to be observing a scene or delivering a command."
Frame 215,"In this frame, a group of armored soldiers and civilians are gathered around a man in a dark cloak, likely during a tense or significant moment within the scene."
Frame 216,"A crowd of people, likely soldiers, are gathered in a stone courtyard with a tall, imposing building in the background."
Frame 217,"The scene depicts a crowd of people gathered in a stone courtyard, likely during a medieval or historical setting."
Frame 218,"A group of warriors, cloaked and carrying weapons, march through a stone street, likely on a mission or journey."
Frame 219,"The frame shows a crowded scene of soldiers and civilians gathered in a stone courtyard, likely during a medieval or historical battle or siege."
Frame 220,"The scene depicts a group of soldiers and a horse-drawn cart moving through a stone courtyard, likely during a battle or military operation."
Frame 221,"The frame shows a dark, dimly lit room with a figure partially obscured by a curtain, creating a sense of mystery and shadow."
Frame 222,"In this frame, a hooded figure stands out in the background amidst a crowd of people, partially obscured by the curtain."
Frame 223,"A hooded figure stands in the shadows, partially obscured by a dark cloak, with a woman and a man visible in the background."
Frame 224,"A fallen soldier lies bound to a wooden cart, surrounded by other soldiers in a dark, chaotic scene."
Frame 225,"The scene shows a chaotic mass of people, many hooded and seemingly trapped within a wooden structure."
Frame 226,"The frame shows a dark, enclosed space with multiple figures seated around a wooden structure, likely a makeshift or temporary setup."
Frame 227,"The image shows a close-up of two figures, likely prisoners, in dark uniforms standing behind a fence, suggesting a bleak and tense environment."
Frame 228,"The frame shows a chaotic scene of numerous, dark-clad figures strewn across a rough, earthen surface, likely after a violent encounter."
Frame 229,"The frame depicts a chaotic scene of numerous bodies, presumably soldiers, strewn across a dark, muddy ground."
Frame 230,"The scene depicts a mass of bodies, likely soldiers, strewn across a muddy, straw-covered ground, suggesting a violent and chaotic battle."
Frame 231,"The frame shows a chaotic scene of numerous soldiers huddled together in a dark, enclosed space, likely a trench, with many of them visibly wounded and exhausted."
Frame 232,"A grizzled, armored knight with a grim expression stares intently at something just out of view, likely focused on a threat or impending battle."
Frame 233,"The frame shows a blurred, dark close-up of a person's face, partially obscured by foliage, with a bright light source in the background."
Frame 234,"A knight in full plate armor is poised, with a determined expression, seemingly about to engage in combat."
Frame 235,"A grizzled, armored knight sits stoically amidst a dark, misty forest, his expression conveying a serious and contemplative mood."
Frame 236,"In the frame, a grizzled warrior is comforting a young, distressed boy with a reassuring hand gesture."
Frame 237,"In a dimly lit, crowded space, a man in a black coat is looking directly at the camera with a serious expression."
Frame 238,"The frame shows a chaotic, flooded cityscape from an aerial perspective, with numerous people wading through the water amidst a damaged building."
