Frame,Caption
Frame 1,The image shows a blurry view of a room with a person in a red robe and a group of people sitting on a patterned couch.
Frame 2,A woman in a red coat enters a room where two men are sitting on a patterned couch.
Frame 3,"Here’s a one-sentence summary of the image: A woman with long, dark hair looks intently into the distance, creating a contemplative and slightly somber expression."
Frame 4,Here's a one-sentence summary of the image: A woman with long brown hair looks intently at the camera with a slightly concerned expression.
Frame 5,Here’s a one-sentence summary of the image: A woman with a serious expression looks directly at the camera in a warmly lit interior.
Frame 6,Here’s a one-sentence summary of the image: A woman with long brown hair looks directly at the camera with a serious and thoughtful expression.
Frame 7,"Here’s a one-sentence summary of the image: A woman with dark hair and a concerned expression looks directly at the camera through a window, suggesting a moment of reflection or apprehension."
Frame 8,"Here’s a one-sentence summary of frame 8: A woman with dark hair and a concerned expression stares intensely into the camera through a window, with a small red stain on her white shirt."
Frame 9,Here’s a one-sentence summary of the image: A woman with a bloodstain on her shirt stares directly at the camera with a terrified expression.
Frame 10,"Here’s a one-sentence summary of the image: A woman in a red cardigan looks shocked and distressed, with a drop of blood on her white shirt, suggesting a violent event has just occurred."
Frame 11,A woman with a bloodstain on her shirt looks toward the camera with a distressed expression.
Frame 12,"Here’s a one-sentence summary of frame 12: A woman stands in a brightly lit room, clutching her neck with a visible bloodstain on her shirt, suggesting a recent injury."
Frame 13,"Here’s a one-sentence summary of the image: A woman with a visible wound on her neck stands in a dimly lit room, appearing distressed and shocked."
Frame 14,"Here’s a one-sentence summary of frame 14: A woman with a bloodstained shirt stands in a room with a distressed expression, suggesting a violent or traumatic event."
Frame 15,"A young woman is seated at a table, clutching her chest with a bleeding wound, likely in a distressed state."
Frame 16,"Here’s a one-sentence summary of the image: A young woman in a red cardigan is holding a bloody knife, looking towards the camera with a distressed expression in a dimly lit room."
Frame 17,"Here’s a one-sentence summary of the image: A woman with blood on her shirt holds a gun in a dimly lit kitchen, appearing distressed and possibly involved in a violent situation."
Frame 18,"In a dimly lit room, a woman wearing a red cardigan looks with a concerned expression at a small, red bird lying on her white shirt."
Frame 19,"The frame shows a blurred interior shot of a building with large windows, suggesting an open and possibly institutional space."
Frame 20,"Here’s a one-sentence summary of the image: A man's face is partially visible through a window, looking out into a dimly lit room with curtains."
Frame 21,"A man in a white shirt appears in a doorway, looking intently at the camera with a serious expression."
Frame 22,"In this frame, a woman in a red cardigan stares directly at the camera while holding a handgun."
Frame 23,"Here's a one-sentence summary of the image: A woman stands in a room with a blood-stained shirt, holding a gun in a tense and unsettling moment."
Frame 24,"A woman, covered in blood, holds a gun in a dimly lit room, seemingly in a moment of distress or confrontation."
Frame 25,"A woman in a red sweater holds a gun in a dimly lit room, appearing tense and potentially threatening."
Frame 26,Here’s a one-sentence summary of frame 26: A woman with a blood-stained shirt looks directly at the camera in a dimly lit room.
Frame 27,"A man in a geometric patterned shirt peers cautiously through a doorway into a brightly lit, modern room."
Frame 28,"Here’s a one-sentence summary of frame 28: A man in a geometric patterned shirt peers cautiously around a corner in a brightly lit, modern room."
Frame 29,A man in a yellow and black striped shirt looks directly at the viewer with a slightly serious expression.
Frame 30,"Here's a one-sentence summary of the image: A man with a beard and a patterned shirt is looking intently at the camera, standing in a room with wooden beams and a window filled with light."
Frame 31,"A man with a yellow and black patterned shirt is smiling and looking at the camera while holding a small, gray object."
Frame 32,"In this blurry frame, a person is sitting on a floor with a dark-colored object near them, likely a bag or container, in a dimly lit space."
Frame 33,"The blurry image shows a person in a dark hoodie reaching toward something on a textured wall, likely a small object."
Frame 34,"A person is sitting on a couch, partially obscured by shadows, with their hand resting on their chest."
Frame 35,"In this frame, Walter White is seen crawling on a plush, patterned couch, seemingly in distress or a moment of panic."
Frame 36,"A man in a yellow patterned shirt is holding a gun, smiling slightly as he looks directly at the camera."
Frame 37,"In this frame, a man wearing a patterned shirt is holding a gun, likely in a tense or dramatic scene."
Frame 38,"In this frame, a man with a beard and patterned swimwear is holding a pistol, smiling broadly."
Frame 39,"In the scene, a man with a patterned shirt and a beard is holding a gun, seemingly aiming it at the camera."
Frame 40,Here’s a one-sentence summary of the image: A woman with blood on her shirt stands with a distressed expression in what appears to be a living room.
Frame 41,A woman with blood on her shirt and neck stands with a horrified expression in a brightly lit room.
Frame 42,"The frame shows a dimly lit room with curtains drawn, casting a striped pattern of light and shadow across the walls."
Frame 43,A man with a bushy white beard and a yellow and black striped shirt is pointing a gun at the camera with a determined expression.
Frame 44,"In this frame, a man with a gray beard and a yellow and black striped shirt is smiling while holding a gun."
Frame 45,"A bearded man in a yellow and black print shirt holds a handgun, looking directly at the camera with a slight smile."
Frame 46,"A man in a yellow and black patterned shirt is looking intently at something in his hand, seemingly in a dimly lit room."
Frame 47,"The frame shows a blurred, close-up view of a person's face, with a patterned pillow visible behind them."
Frame 48,"The frame shows a blurred, dark shot of a person’s head and shoulder, partially illuminated by sunlight streaming through a window."
Frame 49,"Here’s a one-sentence summary of the image: A man in a dark jacket is leaning forward with a distressed expression, partially obscured by a window and wooden structure."
Frame 50,Here's a one-sentence summary of the image: A man with a beard and tattoos is looking intently at a young boy holding a toy gun.
Frame 51,"Here’s a one-sentence summary of frame 51: A man in a suit is seen in a dimly lit room, with a young boy staring intensely at him."
Frame 52,"In this frame, a man in a yellow and black striped shirt is speaking intently to a man in a dark suit, presumably giving instructions or sharing information."
Frame 53,"In this frame, a man in a yellow and black patterned shirt is looking intently at a woman who is partially obscured behind him, suggesting a close and perhaps secretive interaction."
Frame 54,"A man in a gray shirt is seen leaning over a table, looking down intently at something in front of him, with a child's figure partially visible in the background."
Frame 55,"The camera is focused on a dark, reflective surface – likely a window or mirror – with a blurred view of a blue-lit room visible in the background."
Frame 56,"Here's a one-sentence summary of the image: A man is seen crouched down, his upper body and arms visible as he appears to be in a moment of distress or vulnerability in a dimly lit room."
Frame 57,"Here’s a one-sentence summary of frame 57: A man is crouching down, partially obscured by a dark coat, with his head down and a focused expression."
Frame 58,"Here's a one-sentence summary of frame 58: A man in a dark jacket is kneeling on the floor, with a yellow shoe and a yellow object positioned near his feet, likely in a chaotic scene."
Frame 59,"A person in a black jacket and cap is bending over, appearing to be examining something on the floor in a dimly lit room."
Frame 60,"In this frame, a man is shown crouched down on the floor in what appears to be a bedroom, with a partially visible mirror behind him."
Frame 61,"In frame 61, a man is seen bending over and looking down, likely examining something on the floor."
Frame 62,"Here's a one-sentence summary of the image: A man in a gray coat is slumped over a desk, appearing distressed and possibly in a moment of intense thought or emotion."
Frame 63,"Here’s a one-sentence summary of frame 63: A man in a grey suit is slumped over a desk, seemingly distressed and focused on something in front of him."
Frame 64,A man is peering intently at something on the floor in a dimly lit room.
Frame 65,"In this frame, a man with grey hair is visibly shocked and startled, with his mouth open in an expression of surprise."
Frame 66,"Here’s a one-sentence summary of the image: A man in a dark shirt is shown with a surprised and fearful expression, likely reacting to something unexpected."
Frame 67,Here's a one-sentence summary of the image: A man with gray hair and a concerned expression looks directly at the camera from a dimly lit room.
Frame 68,"Here's a one-sentence summary of the image: A man with a worried expression sits in a dimly lit room, seemingly anticipating or reacting to something."
Frame 69,"In this frame, a young man lies on the floor of what appears to be a school hallway, covered in what looks like grain or debris, presumably after being shot."
Frame 70,"A young woman lies lifeless on the floor, covered in blood, in a school setting."
Frame 71,"A young woman lies on the floor, seemingly wounded, surrounded by school chairs in what appears to be a classroom setting."
Frame 72,"A woman lies on the floor, seemingly injured, surrounded by chairs in a dimly lit room."
Frame 73,"A young woman lies injured on the floor of a classroom, surrounded by scattered debris and a discarded firearm."
Frame 74,"A young woman lies lifeless on the floor of a classroom, surrounded by scattered debris."
Frame 75,"A woman lies on the floor, wounded and bleeding, surrounded by school chairs in what appears to be a classroom."
Frame 76,Here's a one-sentence summary of the image: A grizzled man with a weathered face looks intently towards the camera in a dimly lit room.
Frame 77,"Here’s a one-sentence summary of the image: A man with a serious expression, wearing a blue jacket and yellow shirt, looks intently towards the camera in a dimly lit room."
Frame 78,"Here's a one-sentence summary of the image: A man with a startled expression and wide eyes is shown in a dimly lit room, likely reacting to something unexpected."
Frame 79,"A woman looks with apprehension toward a shadowy figure, presumably the villain, in a dimly lit, chaotic setting."
Frame 80,"Here’s a one-sentence summary of the image: A woman with dark hair looks intently into the camera amidst a shadowy, flowing background."
Frame 81,Here's a one-sentence summary of the image: A young woman with dark hair stares intently into the camera in a dimly lit setting.
Frame 82,Here's a one-sentence summary of the image: A dark-haired woman with intense eyes stares directly at the camera in a dimly lit setting.
Frame 83,"In a dimly lit scene, a woman’s face is partially visible, her expression contemplative and slightly melancholic."
Frame 84,"Here’s a one-sentence summary of frame 84: A young woman with dark hair stares intently into the distance, her expression a mix of concern and alertness."
Frame 85,"A knight in dark armor stands in shadow, partially obscured by a grey curtain."
Frame 86,"In this frame, a figure clad in armor stands in a darkened room, with a banner visible behind them."
Frame 87,"A dark-haired man in armor stands with his back to the viewer, partially obscured by dark curtains."
Frame 88,"A dark-haired knight stands in shadow, clad in armor, with a dark cloak draped over his shoulders."
Frame 89,"A dark-armored knight stands in a dimly lit doorway, partially obscured by heavy curtains."
Frame 90,"In a dimly lit forest scene, a young woman with long dark hair stares intently towards the viewer, her expression conveying a sense of fear or apprehension."
Frame 91,"A young woman with dark hair stares intently into the distance, seemingly lost in thought or apprehension, with a shadowy figure partially visible behind her."
Frame 92,"In a dimly lit scene, a woman with long dark hair appears with a frightened and vulnerable expression, seemingly caught in an unsettling moment."
Frame 93,"A dark-haired woman stands in a dimly lit room, gazing at a painting depicting the crucifixion of Jesus Christ."
Frame 94,"A woman in a blue garment stands in a dimly lit room, partially obscured by darkness, with a dramatic depiction of the crucifixion hanging on the wall."
Frame 95,"In this dark scene, a woman in a blue shirt peers intently at a reflection of several menacing figures in a mirrored hallway."
Frame 96,A young woman peers cautiously into a dimly lit room filled with a group of shadowy figures.
Frame 97,"In a dimly lit room, a man with dark hair is seated across from a shadowy figure that appears to be a sinister doppelganger."
Frame 98,A dark figure stands before a painting depicting a crucifixion scene in a dimly lit room.
Frame 99,"A dark-hooded figure stands before a striking, vibrant painting of Jesus Christ on the cross."
Frame 100,A shadowy figure stands before a painting of Christ on the cross in a dimly lit room.
Frame 101,"A dark-robed figure stands in a dimly lit room, gazing at a depiction of the crucifixion on the wall."
Frame 102,"A dark-robed figure stands in a dimly lit room, gazing at a vibrant, unsettling painting of a religious figure."
Frame 103,"A dark-clad figure stands before a painting of a group of men, partially obscured by a dark curtain."
Frame 104,"A dark-clad figure sits in a dimly lit room, gazing at an image of a group of hooded figures, suggesting a sense of isolation and contemplation."
Frame 105,"Here’s a one-sentence summary of the image: A young woman with dark hair stares intently into the darkness, her expression conveying a mix of fear and vulnerability."
Frame 106,"In a blurry, dimly lit scene, a man with a serious expression gently touches his face with his fingers."
Frame 107,"In this blurry frame, a ghostly, pale face—presumably a skull—is partially visible, emerging from darkness with a grim expression."
Frame 108,"In this frame, a dark, shadowed Jesus figure with a beard looks intensely into the camera with a serious expression, enveloped by a dark cloak."
Frame 109,"In the dimly lit scene, Jesus’ face is partially visible, framed by a dark blue or purple cloth."
Frame 110,"In a dark, blurry shot, a woman with a concerned expression looks down, seemingly overwhelmed by a difficult situation."
Frame 111,"In the dimly lit scene, a man is tightly embraced by a large, dark-furred animal, likely a gorilla, creating a sense of intimacy and perhaps tension."
Frame 112,"Here’s a one-sentence summary of frame 112: A shadowy figure with a distressed expression and wide eyes leans forward, seemingly caught in a moment of intense fear or contemplation."
Frame 113,"The frame shows a close-up of a man with teal hair and a textured, armored garment, shrouded in darkness."
Frame 114,"A figure with pale, blue hair and a dark cloak is partially visible in a dark, shadowy setting."
Frame 115,"In this frame, a dark-haired warrior with blue-tinged hair and a beard is seen wearing a metal collar and looking down, likely in a moment of contemplation or distress within a dark, wooded environment."
Frame 116,"In the darkened scene, a figure with a dark-colored jacket and a watch is partially visible, leaning against a wall with a focused expression."
Frame 117,"The frame shows a dark, folded figure draped in dark fabric, partially obscured by shadows."
Frame 118,"In this frame, a dark figure, likely a mannequin, is partially obscured by a dark fabric, with a bright, reflective head visible."
Frame 119,"The video shows a dark, blurry figure with glowing white ears, appearing to be a silhouette of the character Hollow Knight."
Frame 120,"Here's a one-sentence summary of the image: A shadowy figure with a glowing sword is seen firing from the darkness, amidst a ghostly, geometric landscape."
Frame 121,"Here’s a one-sentence summary of frame 121: A close-up shows a man's face intently focused on a dark, complex control panel, likely a mixing board or similar equipment."
Frame 122,Here’s a one-sentence summary of frame 122: A dark-haired man intently focuses on a chessboard with a serious expression.
Frame 123,"Here’s a one-sentence summary of frame 123: A man is seen with his eyes closed and a hand resting on a table in a dimly lit, dark environment."
Frame 124,"Here's a one-sentence summary of frame 124: A dark-haired man intently examines a chess piece with a focused, almost unnerving expression."
Frame 125,"The frame shows a dark, shadowy interior with a large, ornate doorway illuminated by a faint light, with a dark object visible on the left side."
Frame 126,The scene is shrouded in dark shadows with a blurred figure partially visible near a dark doorway.
Frame 127,"The frame shows a blurred, shadowy scene with vertical lines, likely depicting a hallway or corridor in a dark, possibly ancient, setting."
Frame 128,"The frame shows a close-up of a man’s face, with his eyes wide with fear or distress, partially obscured by dark hands."
Frame 129,"In a blurry, dark scene, a person is lying in bed, clutching their head in distress."
Frame 130,A man in a dark hooded coat violently grabs a woman's face as she recoils in fear in a dimly lit room.
Frame 131,"Here’s a one-sentence summary of the image: A close-up shows a man with a long, dark beard exhaling smoke against a blurred, green background."
Frame 132,"Here’s a one-sentence summary of frame 132: A dark-skinned man exhales a cloud of smoke with his eyes closed, creating a hazy effect against the dim background."
Frame 133,"Here's a one-sentence summary of the image: A young boy with blond hair is lying in a bed, partially obscured by a gray blanket, with a slightly fearful or distressed expression."
Frame 134,"In this blurry, dark shot, a man lies deeply asleep under a thick, dark blanket."
Frame 135,"In this frame, a dark figure, presumably a cloaked character, is partially revealed with a serious gaze, suggesting a moment of contemplation or tension."
Frame 136,"In the dark, Darth Vader’s face is partially revealed, conveying a sense of menace and power."
Frame 137,"In the dark, a knight with blue hair and a chainmail cloak stands with a reflective shield in front of him."
Frame 138,"In this frame, a man with a long beard and a dark hooded cloak appears distressed, gazing intensely into the distance with a troubled expression."
Frame 139,"In the dimly lit scene, a figure in a black cloak with a long beard is looking out, lost in thought."
Frame 140,"A dark-cloaked figure with a grim expression stands in the shadows, partially obscured by a blurry, distant form."
Frame 141,"The image shows a dark, blurred figure—presumably Darth Vader—gazing intensely into the distance with a focused, ominous expression."
Frame 142,"A dark figure stands in a grand, marble hallway, partially obscured by a receding shadow."
Frame 143,"The frame shows a blurry, indistinct figure in a white garment, appearing to move within a dark, possibly stormy, environment."
Frame 144,"The image shows a blurred, dark scene with a person’s face and neck visible, suggesting a moment of tension or intimacy in a shadowy environment."
Frame 145,"In this frame, a man is seen kissing a woman deeply, with blurred darkness surrounding them."
Frame 146,"In this blurry, dark frame, a figure is leaning over another, with a bright light illuminating the top of their head."
Frame 147,"A knight in dark armor is looking at a shimmering, ghostly hand."
Frame 148,"In this dark shot, a pale, shadowed face emerges from behind a flowing blue cloth."
Frame 149,"A man in a dark hooded robe stands in a dimly lit room, gazing intensely into the camera."
Frame 150,"The frame shows a blurry, dark scene with a light source and what appears to be a person’s arm or hand."
Frame 151,"The frame shows a dark, shadowy figure’s face partially obscured by dark fabric, creating a mysterious and unsettling image."
Frame 152,"In the dark, a figure’s face is partially obscured by a flowing blue fabric, with a focused gaze looking towards the viewer."
Frame 153,"In the darkened frame, a shadowy figure’s intense gaze is partially obscured by a dark object, creating a sense of mystery and tension."
Frame 154,"The frame shows a dark, textured surface with small, glowing dots scattered across it."
Frame 155,"The frame shows a dark, blurry reflection of a figure and a dark surface, with a bright, glossy texture visible in the foreground."
Frame 156,"The frame shows a blurred, dark shot of a person's face partially obscured by a dark fabric, suggesting a dramatic and possibly tense moment."
Frame 157,"The frame shows a dark, blurred silhouette of Batman amidst swirling, distorted light, suggesting a moment of stealth and potentially heightened sensory perception."
Frame 158,"In this frame, a dark-haired, armored figure is hunched against a dark wooden door, seemingly defeated and in distress."
Frame 159,"A man with a distressed expression is framed in a dark doorway, peering into the darkness."
Frame 160,"A knight in armor is looking intently into the distance, likely preparing for battle."
Frame 161,"In this frame, a dark-clad figure sits hunched over, partially obscured by a reflective surface, suggesting a contemplative or cautious posture within a cold, industrial setting."
Frame 162,"In the dimly lit scene, a man intensely plays a violin with a focused expression, suggesting a dramatic and perhaps tormented performance."
Frame 163,"A man in a dark hoodie is intently focused on manipulating a complex, futuristic device with chopsticks."
Frame 164,"The scene shows a group of figures, shrouded in darkness and viewed through a distorted lens, moving quickly through a grand, stone interior."
Frame 165,"The image shows a distorted view through a window, revealing a dark room filled with figures in dark clothing, likely soldiers, set against a stone wall."
Frame 166,"The frame shows a dimly lit interior with a group of figures standing around a table, shrouded in shadow and partially obscured by a reflective surface."
Frame 167,"Here's a one-sentence summary of the image: A dark-haired man is intently focused on a tightly-packed, shadowy bundle of weapons held in his hands."
Frame 168,"In the dimly lit scene, a man intensely plays a violin, his face illuminated by the instrument's glow."
Frame 169,Here’s a one-sentence summary of the image: A hooded figure with a serious expression stares intently into the distance.
Frame 170,"In this scene, a knight is being restrained by two other knights, with a sword extended towards him."
Frame 171,"In this frame, a dark-clad figure stands facing a group of armored guards within a stone chamber, seemingly in a tense standoff."
Frame 172,"The video shows a blurred, dark, and indistinct view of a person with very light hair, likely in a dimly lit or shadowed environment."
Frame 173,"The frame shows a shadowy figure wearing a textured sweater, partially obscured by a dark, vertical line of light."
Frame 174,"In this frame, a blurred, dark-haired person is partially visible within a blue-tinted space with streaks of light, suggesting movement and a sense of disorientation."
Frame 175,"The frame shows a blurred, dark, and reflective surface, likely a window or mirror, with a hint of a dark shape within it."
Frame 176,"The image shows a blurred, dark-haired man with a hooded cloak, partially obscured by shadows, suggesting a secretive or stealthy moment."
Frame 177,"The frame shows a blurry, dark shot of a warrior in chainmail, likely engaged in battle or a tense moment within a group of combatants."
Frame 178,"The video shows a blurry, dark shot of a man's head and shoulders, partially obscured by a curtain of rain."
Frame 179,"In this frame, a group of guards are running towards the camera, presumably in pursuit of someone, within a dimly lit, ornate hall."
Frame 180,"In this dark, atmospheric shot, a figure in a dark cloak stands in a large, ornate room, likely observing a gathering of people."
Frame 181,"Here’s a one-sentence summary of the image: A man with a beard is intently staring at a computer screen in a dark, dimly lit room."
Frame 182,"In the dimly lit scene, a man with a dark beard and hoodie stares intently into the distance, his face partially obscured by shadows."
Frame 183,"The frame shows a blurred, shadowy close-up of a person’s face, partially obscured by darkness and a vertical green light source."
Frame 184,"The frame shows a dark, blurry figure—presumably Batman—standing in a dimly lit room, with a white object partially visible in front of him."
